{"decision_id":"D-4b99080858c3a616","explanation":"Do not charge this lot; request QA quarantine review. Baseline: 0.0% simulated chance of missing the slot; 100.0% simulated chance of exceeding excursion budget Projected cumulative simulated excursion budget used: 293.8% Verification pending: TODO(verify): Port of Switzerland navigation bands; TODO(verify): Basel high-water stop; TODO(verify): traffic stations and capacity mapping River sensitivity override: 150 cm, simulated","headline":"Do not charge this lot; request QA quarantine review","lot":"SIM-26-0814","reasons":[{"at":"2026-07-25T09:00:00+00:00","n":1,"source":"decision_analysis: 2000 paired seeded simulated journeys per action","text":"Baseline: 0.0% simulated chance of missing the slot; 100.0% simulated chance of exceeding excursion budget"},{"at":"2026-07-30T18:40:19.612053+00:00","n":2,"source":"timeline.json + ASSUMED config/material.yaml","text":"Projected cumulative simulated excursion budget used: 293.8%"},{"at":"2026-07-25T09:00:00+00:00","n":3,"source":"data/cache verification metadata","text":"Verification pending: TODO(verify): Port of Switzerland navigation bands; TODO(verify): Basel high-water stop; TODO(verify): traffic stations and capacity mapping"},{"at":"2026-07-25T09:00:00+00:00","n":4,"source":"ASSUMED scenarios/s2_heat_2026-07-30.yaml sensitivity value, not a gauge reading","text":"River sensitivity override: 150 cm, simulated"}],"recommended":"QUARANTINE","rejected":[{"action":"RUN_AS_PLANNED","at":"2026-07-25T09:00:00+00:00","reason":"Quarantine has priority when the excursion limit is exceeded","source":"decision_analysis: 2000 paired seeded simulated journeys per action"},{"action":"EXPEDITE","at":"2026-07-25T09:00:00+00:00","reason":"Quarantine has priority when the excursion limit is exceeded","source":"decision_analysis: 2000 paired seeded simulated journeys per action"},{"action":"BUFFER","at":"2026-07-25T09:00:00+00:00","reason":"Quarantine has priority when the excursion limit is exceeded","source":"decision_analysis: 2000 paired seeded simulated journeys per action"},{"action":"REROUTE","at":"2026-07-25T09:00:00+00:00","reason":"Quarantine has priority when the excursion limit is exceeded","source":"decision_analysis: 2000 paired seeded simulated journeys per action"}],"requires_approval_by":"QA","scenario_id":"s2_heat_2026-07-30","slot":"R2 2026-07-31T06:00:00+02:00","sources":{"approval":"human authorization required; browser roles are demo labels, not authentication","recommendation":"rules/engine.py; ASSUMED thresholds; Monte Carlo probabilities"},"would_change_if":["Cold-store stock changes","Measured river level changes","Handover exposure or reactor readiness changes","For afternoon heat exposure: unload before 10:00 Basel local time"]}
