{"decision_id":"D-6af4d009b171e523","explanation":"Material forecast to meet the slot within the configured budget. Baseline: 0.0% simulated chance of missing the slot; 0.0% simulated chance of exceeding excursion budget Projected cumulative simulated excursion budget used: 0.0% Verification pending: TODO(verify): Port of Switzerland navigation bands; TODO(verify): Basel high-water stop; TODO(verify): traffic stations and capacity mapping River sensitivity override: 150 cm, simulated","headline":"Material forecast to meet the slot within the configured budget","lot":"SIM-26-0814","reasons":[{"at":"2026-05-05T09:00:00+00:00","n":1,"source":"decision_analysis: 2000 paired seeded simulated journeys per action","text":"Baseline: 0.0% simulated chance of missing the slot; 0.0% simulated chance of exceeding excursion budget"},{"at":"2026-05-10T14:27:29.985913+00:00","n":2,"source":"timeline.json + ASSUMED config/material.yaml","text":"Projected cumulative simulated excursion budget used: 0.0%"},{"at":"2026-05-05T09:00:00+00:00","n":3,"source":"data/cache verification metadata","text":"Verification pending: TODO(verify): Port of Switzerland navigation bands; TODO(verify): Basel high-water stop; TODO(verify): traffic stations and capacity mapping"},{"at":"2026-05-05T09:00:00+00:00","n":4,"source":"ASSUMED scenarios/s1_normal_2026-05-10.yaml sensitivity value, not a gauge reading","text":"River sensitivity override: 150 cm, simulated"}],"recommended":"RUN_AS_PLANNED","rejected":[{"action":"EXPEDITE","at":"2026-05-05T09:00:00+00:00","reason":"Baseline arrival risk is already low","source":"decision_analysis: 2000 paired seeded simulated journeys per action"},{"action":"BUFFER","at":"2026-05-05T09:00:00+00:00","reason":"The lot is forecast to arrive in time within the excursion limit","source":"decision_analysis: 2000 paired seeded simulated journeys per action"},{"action":"REROUTE","at":"2026-05-05T09:00:00+00:00","reason":"Higher or tied expected simulated batch delay (0.0 min)","source":"decision_analysis: 2000 paired seeded simulated journeys per action"},{"action":"QUARANTINE","at":"2026-05-05T09:00:00+00:00","reason":"No measured or predicted excursion budget exceedance above the configured threshold","source":"decision_analysis: 2000 paired seeded simulated journeys per action"}],"requires_approval_by":"operator","scenario_id":"s1_normal_2026-05-10","slot":"R2 2026-05-11T06:00:00+02:00","sources":{"approval":"human authorization required; browser roles are demo labels, not authentication","recommendation":"rules/engine.py; ASSUMED thresholds; Monte Carlo probabilities"},"would_change_if":["Cold-store stock changes","Measured river level changes","Handover exposure or reactor readiness changes","For afternoon heat exposure: unload before 10:00 Basel local time"]}
