{"decision_id":"D-65e81dd2f708a300","explanation":"Use cold-store safety stock for this batch. Baseline: 100.0% simulated chance of missing the slot; 0.0% simulated chance of exceeding excursion budget Projected cumulative simulated excursion budget used: 0.0% Kaub gauge -6.0 cm; route suspended under ASSUMED navigation bands Verification pending: TODO(verify): Port of Switzerland navigation bands; TODO(verify): Basel high-water stop; TODO(verify): traffic station selection; neutral ASSUMED factor used","headline":"Use cold-store safety stock for this batch","lot":"SIM-26-0814","reasons":[{"at":"2026-10-01T00:45:00+00:00","n":1,"source":"decision_analysis: 2000 paired seeded simulated journeys per action","text":"Baseline: 100.0% simulated chance of missing the slot; 0.0% simulated chance of exceeding excursion budget"},{"at":"2026-10-01T03:46:14.638867+00:00","n":2,"source":"timeline.json + ASSUMED config/material.yaml","text":"Projected cumulative simulated excursion budget used: 0.0%"},{"at":"2026-10-01T02:45:00+02:00","n":3,"source":"https://www.pegelonline.wsv.de/webservices/rest-api/v2/stations/KAUB/W/measurements.json?start=P31D","text":"Kaub gauge -6.0 cm; route suspended under ASSUMED navigation bands"},{"at":"2026-10-01T00:45:00+00:00","n":4,"source":"data/cache verification metadata","text":"Verification pending: TODO(verify): Port of Switzerland navigation bands; TODO(verify): Basel high-water stop; TODO(verify): traffic station selection; neutral ASSUMED factor used"}],"recommended":"BUFFER","rejected":[{"action":"RUN_AS_PLANNED","at":"2026-10-01T00:45:00+00:00","reason":"Baseline does not meet the configured low-delay and excursion-margin criteria","source":"decision_analysis: 2000 paired seeded simulated journeys per action"},{"action":"EXPEDITE","at":"2026-10-01T00:45:00+00:00","reason":"The route is suspended; a faster slot on the same route cannot resolve it","source":"decision_analysis: 2000 paired seeded simulated journeys per action"},{"action":"REROUTE","at":"2026-10-01T00:45:00+00:00","reason":"Alternative route increases excursion risk or still risks missing the slot","source":"decision_analysis: 2000 paired seeded simulated journeys per action"},{"action":"QUARANTINE","at":"2026-10-01T00:45:00+00:00","reason":"No measured or predicted excursion budget exceedance above the configured threshold","source":"decision_analysis: 2000 paired seeded simulated journeys per action"}],"requires_approval_by":"operator","scenario_id":"s3_lowriver_2026-10-01","slot":"R2 2026-10-01T06:00:00+02:00","sources":{"approval":"human authorization required; browser roles are demo labels, not authentication","recommendation":"rules/engine.py; ASSUMED thresholds; Monte Carlo probabilities"},"would_change_if":["Cold-store stock changes","Measured river level changes","Handover exposure or reactor readiness changes","For afternoon heat exposure: unload before 10:00 Basel local time"]}
