{"decision_id":"D-9e7a0fb779dfdac8","explanation":"Use cold-store safety stock for this batch. Baseline: 100.0% simulated chance of missing the slot; 0.0% simulated chance of exceeding excursion budget Projected cumulative simulated excursion budget used: 0.0% Verification pending: TODO(verify): Port of Switzerland navigation bands; TODO(verify): Basel high-water stop; TODO(verify): traffic stations and capacity mapping River sensitivity override: 80 cm, simulated","headline":"Use cold-store safety stock for this batch","lot":"SIM-26-0814","reasons":[{"at":"2026-05-05T09:00:00+00:00","n":1,"source":"decision_analysis: 2000 paired seeded simulated journeys per action","text":"Baseline: 100.0% simulated chance of missing the slot; 0.0% simulated chance of exceeding excursion budget"},{"at":"2026-05-11T14:09:22.190009+00:00","n":2,"source":"timeline.json + ASSUMED config/material.yaml","text":"Projected cumulative simulated excursion budget used: 0.0%"},{"at":"2026-05-05T09:00:00+00:00","n":3,"source":"data/cache verification metadata","text":"Verification pending: TODO(verify): Port of Switzerland navigation bands; TODO(verify): Basel high-water stop; TODO(verify): traffic stations and capacity mapping"},{"at":"2026-05-05T09:00:00+00:00","n":4,"source":"ASSUMED config/demo_variants.yaml simulated river sensitivity; not a measurement","text":"River sensitivity override: 80 cm, simulated"}],"recommended":"BUFFER","rejected":[{"action":"RUN_AS_PLANNED","at":"2026-05-05T09:00:00+00:00","reason":"Baseline does not meet the configured low-delay and excursion-margin criteria","source":"decision_analysis: 2000 paired seeded simulated journeys per action"},{"action":"EXPEDITE","at":"2026-05-05T09:00:00+00:00","reason":"Higher or tied expected simulated batch delay (540.1 min)","source":"decision_analysis: 2000 paired seeded simulated journeys per action"},{"action":"REROUTE","at":"2026-05-05T09:00:00+00:00","reason":"Higher or tied expected simulated batch delay (0.0 min)","source":"decision_analysis: 2000 paired seeded simulated journeys per action"},{"action":"QUARANTINE","at":"2026-05-05T09:00:00+00:00","reason":"No measured or predicted excursion budget exceedance above the configured threshold","source":"decision_analysis: 2000 paired seeded simulated journeys per action"}],"requires_approval_by":"operator","scenario_id":"s1_normal_2026-05-10","slot":"R2 2026-05-11T06:00:00+02:00","sources":{"approval":"human authorization required; browser roles are demo labels, not authentication","recommendation":"rules/engine.py; ASSUMED thresholds; Monte Carlo probabilities"},"would_change_if":["Cold-store stock changes","Measured river level changes","Handover exposure or reactor readiness changes","For afternoon heat exposure: unload before 10:00 Basel local time"]}
